{
  "id": "c5e8d2a1-7b3f-4c9e-9d1a-2f3b4c5d6e06",
  "kind": "site",
  "name": "Purchasing",
  "formatVersion": 1,
  "path": "purchasing",
  "title": { "textKey": "purchasing.title" },
  "locales": { "default": "en", "fallback": "en", "available": ["en", "vi"] },
  "navigation": [{ "page": "PurchaseRequests", "label": { "textKey": "purchasing.nav.requests" } }]
}
