{
  "id": "7a3e9c10-2b4d-4e6f-8a90-1c2d3e4f5a04",
  "kind": "site",
  "name": "E2e",
  "formatVersion": 1,
  "path": "e2e",
  "title": { "textKey": "site.title" },
  "locales": { "default": "en", "fallback": "en", "available": ["en", "vi"] },
  "navigation": [
    { "page": "Notes", "label": { "textKey": "nav.notes" } },
    { "page": "Categories", "label": { "textKey": "nav.categories" } },
    { "page": "Tasks", "label": { "textKey": "nav.tasks" } }
  ]
}
